id,play_flag,time_scale,last_played,title,title_reading,composer,composer_reading,performer,performer_reading,copyright,source,remarks
001,1,4,,Chaconne from Partita No. 2 for Violin BWV 1004,ゔぁいおりんぱるてぃーた・だいにばんより・しゃこんぬ,J.S. Bach,ばっは,Peter Schmidt,ぺーたー・しゅみっと,PDM 1.0,Musopen,
002,1,4,,Violin Partita no. 1 BWV 1002,ゔぁいおりんぱるてぃーた・だいいちばん・ろたんちょう,J.S. Bach,ばっは,Emil Telmanyi,てるまーにー・えみる,PDM 1.0,Musopen,
003,1,8,,Violin Partita no. 3 BWV 1006,ゔぁいおりんぱるてぃーた・だいさんばん・ほちょうちょう,J.S. Bach,ばっは,Emil Telmanyi,てるまーにー・えみる,PDM 1.0,Musopen,
004,1,5,,Violin Sonata no. 3 in C major BWV 1005,ゔぁいおりんそなた・だいさんばん・はちょうちょう,J.S. Bach,ばっは,Emil Telmanyi,てるまーにー・えみる,PDM 1.0,Musopen,
005,1,9,,La Campanella,ら・かんぱねら,Franz Liszt,ふらんつ・りすと,MMT38,えむえむてぃーさんじゅうはち,PDM 1.0,MMT38,
006,1,6,,The Seasons - 04 - April - Snowdrop,しき・しがつ・まつゆきそう,Pyotr Tchaikovsky,ぴょーとる・ちゃいこふすきー,Gregor Quendel,ぐれごーる・けんでる,CC BY 4.0,Classicals.de,
007,1,3,,The Seasons - 10 - October - Autumn Song,しき・じゅうがつ・あきのうた,Pyotr Tchaikovsky,ぴょーとる・ちゃいこふすきー,Gregor Quendel,ぐれごーる・けんでる,CC BY 4.0,Classicals.de,
008,1,4,,Je demande a l'oiseau,じゅ・でゅまんだ・ろわぞー,Amy Beach,えいみー・びーち,Gregor Quendel,ぐれごーる・けんでる,CC BY 4.0,Classicals.de,
009,1,9,,Sonata No. 2 - 1. Presto (1707),そなただいにばん・だいいちがくしょう・ぷれすと,Elisabeth Jacquet de la Guerre,えりざべと・じゃけ・どらげーる,Gregor Quendel,ぐれごーる・けんでる,CC BY 4.0,Classicals.de,
010,1,2,2026-02-12T00:32:46.424064+09:00,Valse mélancolique in F-sharp minor (spurious),ゆううつなわるつ・えいへたんちょう,Frederic Chopin,ふれでりっく・しょぱん,Gregor Quendel,ぐれごーる・けんでる,CC BY 4.0,Classicals.de,
011,1,2,,Cello Suite no. 3 in C major BWV 1009,むばんそうちぇろくみきょく・だいさんばん・はちょうちょう,J.S. Bach,ばっは,János Starker,やーのしゅ・しゅたるける,PDM 1.0,Musopen,
012,1,3,,Lied ohne Worte Op.109,むごんか・にちょうちょう,Felix Mendelssohn,ふぇりっくす・めんでるすぞーん,Colin Carr,こりん・かー,CC BY-NC-ND 3.0,Musopen,
013,1,4,,Concerto grosso in F minor Op.1 No.8,こんちぇるとぐろっそ・さくひんいち・だいはちばん・へたんちょう,Pietro Locatelli,ぴえとろ・ろかてっり,The Modena Chamber Orchestra,もでな・ちぇんばーおーけすとら,PDM 1.0,Musopen,
014,1,9,2026-02-11T23:57:29.385598+09:00,Violin Concerto in E major RV 269 'Spring',ゔぁいおりんきょうそうきょく・ほちょうちょう・しきより・はる,Antonio Vivaldi,ゔぃゔぁるでぃ,The Modena Chamber Orchestra,もでな・ちぇんばーおーけすとら,PDM 1.0,Musopen,
015,1,9,2026-02-12T00:02:25.963332+09:00,Violin Concerto in G minor RV 315 'Summer',ゔぁいおりんきょうそうきょく・とたんちょう・しきより・なつ,Antonio Vivaldi,ゔぃゔぁるでぃ,The Modena Chamber Orchestra,もでな・ちぇんばーおーけすとら,PDM 1.0,Musopen,
016,1,7,,Violin Concerto in F major RV 293 'Autumn',ゔぁいおりんきょうそうきょく・へちょうちょう・しきより・あき,Antonio Vivaldi,ゔぃゔぁるでぃ,The Modena Chamber Orchestra,もでな・ちぇんばーおーけすとら,PDM 1.0,Musopen,
017,1,3,,Violin Concerto in F minor RV 297 'Winter',ゔぁいおりんきょうそうきょく・へたんちょう・しきより・ふゆ,Antonio Vivaldi,ゔぃゔぁるでぃ,The Modena Chamber Orchestra,もでな・ちぇんばーおーけすとら,PDM 1.0,Musopen,
018,1,2,2026-02-12T00:27:57.315854+09:00,Oboe Concerto in D minor Op. 9 no.2 - II. Adagio,おーぼえきょうそうきょく・にたんちょう・さくひんきゅうのだいにばん・だいにがくしょう・あだーじょ,Tomaso Albinoni,とまぞ・あるびのーに,Paul Arden-Taylor,ぽーる・あーでん・ていらー,PDM 1.0,Musopen,
019,1,7,,Anon - Medieval Dance Tunes,あのにます・ちゅうせいのだんすきょく,Anonymous,あのにます,Paul Arden-Taylor,ぽーる・あーでん・ていらー,PDM 1.0,Musopen,
020,1,8,,Concerto for 2 Mandolins in G major RV 532,にほんのまんどりんのためのきょうそうきょく・とちょうちょう,Antonio Vivaldi,あんとにお・ゔぃゔぁるでぃ,Advent Chamber Orchestra,あどゔぇんと・ちぇんばーおーけすとら,PDM 1.0,Musopen,
021,1,1,2026-02-12T00:18:10.560474+09:00,Lyric Pieces Op. 54 - IV. Notturno,じょじょうしょうきょくしゅう・だいごしゅう・よそうきょく,Edvard Grieg,えどゔぁるど・ぐりーぐ,Edward Rosser,えどわーど・ろっさー,PDM 1.0,Musopen,
022,1,1,,3 Gymnopédies - I. Lent et douloureux,じむのぺでぃ・だいいちばん,Erik Satie,えりっく・さてぃ,Luis Kolodin,るいす・ころでぃん,CC BY-SA 4.0,IMSLP,
023,1,1,2026-02-12T00:07:27.078450+09:00,Nocturne in E minor Op. posth. 72 No. 1,よそうきょく・だいじゅうきゅうばん・ほたんちょう・いさく,Frederic Chopin,ふれでりっく・しょぱん,Luke Faulkner,るーく・ふぉーくなー,PDM 1.0,Musopen,
024,1,2,,Goldberg Variations BWV 988 - Aria,ごるとべるくへんそうきょく・ありあ,J.S. Bach,ばっは,Shelley Katz,しぇりー・かっつ,PDM 1.0,Musopen,Shelley Katz is Male.
025,1,1,,Goldberg Variations BWV 988 - Variation 25,ごるとべるくへんそうきょく・だいにじゅうごへんそう,J.S. Bach,ばっは,Shelley Katz,しぇりー・かっつ,PDM 1.0,Musopen,
026,1,3,2026-02-12T00:12:07.781522+09:00,Goldberg Variations BWV 988 - Variation 13,ごるとべるくへんそうきょく・だいじゅうさんへんそう,J.S. Bach,ばっは,Shelley Katz,しぇりー・かっつ,PDM 1.0,Musopen,
027,1,2,2026-02-12T00:23:05.555677+09:00,Goldberg Variations BWV 988 - Variation 15,ごるとべるくへんそうきょく・だいじゅうごへんそう,J.S. Bach,ばっは,Shelley Katz,しぇりー・かっつ,PDM 1.0,Musopen,
028,1,3,,Goldberg Variations BWV 988 - Variation 21,ごるとべるくへんそうきょく・だいにじゅういちへんそう,J.S. Bach,ばっは,Shelley Katz,しぇりー・かっつ,PDM 1.0,Musopen,
029,1,2,,Goldberg Variations BWV 988 - Aria da Capo,ごるとべるくへんそうきょく・ありあ・だ・かーぽ,J.S. Bach,ばっは,Shelley Katz,しぇりー・かっつ,PDM 1.0,Musopen,
030,1,7,,6 Pezzi pastorali Op. 139 - I. Egloga,むっつのぱすとらるなしょうきょく・さくひんひゃくさんじゅうきゅう・だいいちばん・えぐろーが,Luigi Botazzo,るいーじ・ぼたっつぉ,Erik Jan Eradus,えりっく・やん・えらどぅす,CC BY-NC-SA 3.0,Musopen,
031,1,7,,6 Pezzi pastorali Op. 139 - II. Idillio,むっつのぱすとらるなしょうきょく・さくひんひゃくさんじゅうきゅう・だいにばん・いでぃっりお,Luigi Botazzo,るいーじ・ぼたっつぉ,Erik Jan Eradus,えりっく・やん・えらどぅす,CC BY-NC-SA 3.0,Musopen,
032,1,8,,6 Pezzi pastorali Op. 139 - III. Coro,むっつのぱすとらるなしょうきょく・さくひんひゃくさんじゅうきゅう・だいさんばん・こーろ,Luigi Botazzo,るいーじ・ぼたっつぉ,Erik Jan Eradus,えりっく・やん・えらどぅす,CC BY-NC-SA 3.0,Musopen,
033,1,5,,6 Pezzi pastorali Op. 139 - IV. Preghiera,むっつのぱすとらるなしょうきょく・さくひんひゃくさんじゅうきゅう・だいよんばん・ぷれぎえーら,Luigi Botazzo,るいーじ・ぼたっつぉ,Erik Jan Eradus,えりっく・やん・えらどぅす,CC BY-NC-SA 3.0,Musopen,
034,1,7,,6 Pezzi pastorali Op. 139 - V. Offertorio,むっつのぱすとらるなしょうきょく・さくひんひゃくさんじゅうきゅう・だいごばん・おっふぇるとりお,Luigi Botazzo,るいーじ・ぼたっつぉ,Erik Jan Eradus,えりっく・やん・えらどぅす,CC BY-NC-SA 3.0,Musopen,
035,1,6,,6 Pezzi pastorali Op. 139 - VI. Postludio,むっつのぱすとらるなしょうきょく・さくひんひゃくさんじゅうきゅう・だいりくばん・ぽすとるでぃお,Luigi Botazzo,るいーじ・ぼたっつぉ,Erik Jan Eradus,えりっく・やん・えらどぅす,CC BY-NC-SA 3.0,Musopen,
036,1,2,,Lyric Pieces Op. 12 - I. Arietta,じょじょうしょうきょくしゅう・さくひんじゅうに・だいいちばん・ありえった,Edvard Grieg,えどゔぁるど・ぐりーぐ,Edward Rosser,えどわーど・ろっさー,PDM 1.0,Musopen,
037,1,4,,French Suite no. 5 in G major BWV 816,ふらんすくみきょく・だいごばん・とちょうちょう,J.S. Bach,ばっは,Peter Bradley-Fulgoni,ぴーたー・ぶらっどれー・ふるごーに,CC BY-NC-ND 3.0,Musopen,
036,1,2,,Lyric Pieces Op. 12 No. 1 Arietta,じょじょうしょうきょくしゅう・だいいちばん・ありえった,Edvard Grieg,えどゔぁるど・ぐりーぐ,Edward Rosser,えどわーど・ろっさー,PDM 1.0,Musopen,
037,1,4,,French Suite No. 5 in G major BWV 816,ふらんすくみきょく・だいごばん・とちょうちょう,Johann Sebastian Bach,じょはん・ぜばすてぃあん・ばっは,Peter Bradley-Fulgoni,ぴーたー・ぶらっどれー・ふるごーに,CC BY-NC-ND 3.0,Musopen,
038,1,6,,8 Piano Pieces Op. 76 No. 1 Capriccio in F-sharp minor,やっつのぴあのしょうきょく・だいいちばん・きそうきょく・えいへたんちょう,Johannes Brahms,よはねす・ぶらーむす,Luis Sarro,るいす・さーろ,PDM 1.0,Musopen,
039,1,4,,8 Piano Pieces Op. 76 No. 2 Capriccio in B minor,やっつのぴあのしょうきょく・だいにばん・きそうきょく・ろたんちょう,Johannes Brahms,よはねす・ぶらーむす,Luis Sarro,るいす・さーろ,PDM 1.0,Musopen,
040,1,2,,8 Piano Pieces Op. 76 No. 3 Intermezzo in A-flat major,やっつのぴあのしょうきょく・だいさんばん・かんそうきょく・へんいちょうちょう,Johannes Brahms,よはねす・ぶらーむす,Luis Sarro,るいす・さーろ,PDM 1.0,Musopen,
041,1,3,,8 Piano Pieces Op. 76 No. 4 Intermezzo in B-flat major,やっつのぴあのしょうきょく・だいよんばん・かんそうきょく・へんほちょうちょう,Johannes Brahms,よはねす・ぶらーむす,Luis Sarro,るいす・さーろ,PDM 1.0,Musopen,
042,1,6,,8 Piano Pieces Op. 76 No. 5 Capriccio in C-sharp minor,やっつのぴあのしょうきょく・だいごばん・きそうきょく・えいはたんちょう,Johannes Brahms,よはねす・ぶらーむす,Luis Sarro,るいす・さーろ,PDM 1.0,Musopen,
043,1,2,,8 Piano Pieces Op. 76 No. 6 Intermezzo in A major,やっつのぴあのしょうきょく・だいろくばん・かんそうきょく・いちょうちょう,Johannes Brahms,よはねす・ぶらーむす,Luis Sarro,るいす・さーろ,PDM 1.0,Musopen,
044,1,2,,8 Piano Pieces Op. 76 No. 7 Intermezzo in A minor,やっつのぴあのしょうきょく・だいななばん・かんそうきょく・いたんちょう,Johannes Brahms,よはねす・ぶらーむす,Luis Sarro,るいす・さーろ,PDM 1.0,Musopen,
045,1,5,,8 Piano Pieces Op. 76 No. 8 Capriccio in C major,やっつのぴあのしょうきょく・だいはちばん・きそうきょく・はちょうちょう,Johannes Brahms,よはねす・ぶらーむす,Luis Sarro,るいす・さーろ,PDM 1.0,Musopen,
